{
  "schema": "dna-arranger-project-checkpoint",
  "version": "1.0",
  "checkpointId": "checkpoint-e8617a4321129a3e5c34",
  "projectHash": "fcaa2eead353a05a2713d8bd566e62135782cb067f7f5399ccda1c117b0dccaa",
  "sourceMidiSha256": "fed28674999e3c822d23737f82492e7e6d33e689b292e4400833b90617a93425",
  "resumeStage": "RENDER",
  "reason": "CRASH_RECOVERY",
  "completedStages": [
    "IMPORT",
    "ANALYZE",
    "BRIEF",
    "PLAN",
    "SELECT"
  ],
  "lastConfirmedStageHash": "d9df2f0ab36a5e2e82b1b7eb66d3344168485d675e14da490a32ab4784f41f19",
  "controls": {
    "selectedVariantId": "C",
    "lockedMarkers": [],
    "projectSeed": 3535,
    "previewTier": "PREVIEW_ONLY"
  },
  "history": {
    "entries": [],
    "cursor": 0,
    "undoAvailable": false,
    "redoAvailable": false
  },
  "midiEmbedded": false,
  "checkpointHash": "0198f4f7a664a5e9bf2dc614df6ce92f87c9f2fca57bb3c815885b674cdf1474"
}
